{
  "schemaVersion": "0.1.0",
  "sourceRecordId": "gaia-src-facility-risk-cve-exposure",
  "sourceName": "Synthetic CVE Exposure Feed",
  "sourceFamily": "cyber",
  "routeFamily": "fixture/orion/facility-risk",
  "sourceUrl": "fixture://orion/facility-risk/cve-exposure",
  "observedAt": "2026-05-29T12:02:00Z",
  "ingestedAt": "2026-05-29T12:03:00Z",
  "licenseStatus": "approved_for_fixture",
  "attributionRequired": false,
  "commercialUseStatus": "allowed",
  "evidenceGrade": "fixture.synthetic",
  "riskClass": "low",
  "provenance": {
    "retrievalMode": "fixture",
    "hashAlgorithm": "none",
    "canonicalizationStatus": "not_applicable",
    "retrievalNotes": "Synthetic cyber exposure record for Orion OSIRIS excavation MVP."
  },
  "confidenceContribution": 0.65,
  "notes": "Represents the cyber exposure leg of the facility-risk scenario."
}
