{
  "schemaVersion": "0.1.0",
  "sourceRecordId": "gaia-src-facility-risk-field-report",
  "sourceName": "Synthetic Operator Field Report",
  "sourceFamily": "field_report",
  "routeFamily": "fixture/orion/facility-risk",
  "sourceUrl": "fixture://orion/facility-risk/field-report",
  "observedAt": "2026-05-29T12:06:00Z",
  "ingestedAt": "2026-05-29T12:07:00Z",
  "licenseStatus": "approved_for_fixture",
  "attributionRequired": false,
  "commercialUseStatus": "allowed",
  "evidenceGrade": "operator_report.unverified",
  "riskClass": "low",
  "provenance": {
    "retrievalMode": "fixture",
    "hashAlgorithm": "none",
    "canonicalizationStatus": "not_applicable",
    "retrievalNotes": "Synthetic operator field report for Orion OSIRIS excavation MVP."
  },
  "confidenceContribution": 0.55,
  "notes": "Represents the human observation leg of the facility-risk scenario."
}
